{
  "viewport": { "width": 1440, "height": 900 },
  "maxIterations": 12,
  "defaultThreshold": 0.85,
  "defaultWeights": { "layout": 0.3, "color": 0.2, "typography": 0.2, "pixel": 0, "visual": 0.3 },
  "signals": {
    "layout":     { "module": "signals/layout.mjs", "enabled": true },
    "color":      { "module": "signals/color.mjs",  "enabled": true, "maxDeltaE": 50 },
    "typography": { "module": "signals/typo.mjs",   "enabled": true },
    "pixel":      { "module": "signals/pixel.mjs",  "enabled": false },
    "visual":     { "module": "signals/visual.mjs", "enabled": false, "model": "claude-sonnet-4-6" }
  },
  "judge": { "stallWindow": 3, "minDelta": 0.01 }
}
